{
    "id": "navbar",
    "version": "1.0.0",
    "category": "ui.primitive",
    "description": "Barre de navigation horizontale responsive avec menu mobile",
    "inputs": {
        "type": "object",
        "properties": {
            "logo": {
                "type": "object",
                "properties": {
                    "text": {
                        "type": "string"
                    },
                    "image": {
                        "type": "string"
                    },
                    "href": {
                        "type": "string",
                        "default": "\/"
                    }
                },
                "default": {
                    "text": "Logo",
                    "href": "\/"
                }
            },
            "items": {
                "type": "array",
                "items": {
                    "type": "object",
                    "properties": {
                        "label": {
                            "type": "string"
                        },
                        "href": {
                            "type": "string"
                        },
                        "active": {
                            "type": "boolean",
                            "default": false
                        },
                        "children": {
                            "type": "array",
                            "items": {
                                "type": "object",
                                "properties": {
                                    "label": {
                                        "type": "string"
                                    },
                                    "href": {
                                        "type": "string"
                                    }
                                }
                            }
                        }
                    }
                },
                "default": []
            },
            "actions": {
                "type": "array",
                "items": {
                    "type": "object",
                    "properties": {
                        "label": {
                            "type": "string"
                        },
                        "href": {
                            "type": "string"
                        },
                        "variant": {
                            "type": "string",
                            "enum": [
                                "primary",
                                "secondary",
                                "ghost"
                            ],
                            "default": "primary"
                        }
                    }
                },
                "default": []
            },
            "variant": {
                "type": "string",
                "enum": [
                    "solid",
                    "transparent",
                    "blur"
                ],
                "default": "solid"
            },
            "colorScheme": {
                "type": "string",
                "enum": [
                    "light",
                    "dark"
                ],
                "default": "light"
            },
            "sticky": {
                "type": "string",
                "enum": [
                    "none",
                    "top",
                    "scroll"
                ],
                "default": "none"
            },
            "breakpoint": {
                "type": "string",
                "enum": [
                    "sm",
                    "md",
                    "lg"
                ],
                "default": "md"
            },
            "alignment": {
                "type": "string",
                "enum": [
                    "left",
                    "center",
                    "spread"
                ],
                "default": "spread"
            },
            "className": {
                "type": "string",
                "default": ""
            }
        },
        "required": []
    },
    "tags": [
        "ui",
        "primitive",
        "navigation",
        "header",
        "responsive"
    ],
    "examples": [
        {
            "name": "Navbar simple",
            "inputs": {
                "logo": {
                    "text": "Bricks",
                    "href": "\/"
                },
                "items": [
                    {
                        "label": "Home",
                        "href": "\/",
                        "active": true
                    },
                    {
                        "label": "Features",
                        "href": "\/features"
                    },
                    {
                        "label": "Pricing",
                        "href": "\/pricing"
                    }
                ],
                "actions": [
                    {
                        "label": "Login",
                        "href": "\/login",
                        "variant": "ghost"
                    },
                    {
                        "label": "Sign up",
                        "href": "\/register",
                        "variant": "primary"
                    }
                ]
            }
        },
        {
            "name": "Navbar sticky blur",
            "inputs": {
                "logo": {
                    "text": "App",
                    "href": "\/"
                },
                "items": [
                    {
                        "label": "Docs",
                        "href": "\/docs"
                    },
                    {
                        "label": "Blog",
                        "href": "\/blog"
                    }
                ],
                "variant": "blur",
                "sticky": "top"
            }
        }
    ]
}